{
  "schema_version": "w3.private.w1-lifecycle-receipt/1.0",
  "message_type": "w3.private.w1.lifecycle-receipt",
  "receipt_id": "55555555-5555-4555-8555-555555555555",
  "occurred_at": "2026-09-20T08:35:00Z",
  "visibility_scope": "PRIVATE",
  "producer": "w3",
  "command_id": "88888888-8888-4888-8888-888888888888",
  "target_ref": "66666666-6666-4666-8666-666666666666",
  "operation": "RETIRE_SOURCE",
  "outcome": "APPLIED",
  "affected_count": 1,
  "applied_epoch": null,
  "effective_at": "2026-09-20T08:33:43Z"
}
